,UserID,Review_Text,Date,NumberOfVisit
0,타임1975,신라호텔에 오면 정말 꼭 해야할 꿀팁 정리했습니다 1 발렛을 꼭하세요 제휴카드가 있으면 무료지만 제휴카드가 없더라도 33000원 결제시 가발렛을 해주시고요 체크인시간 아깝고 주차장에서 왔다갔다 짐옮기기 어려운 모든걸 해결할수있습니다 여기서 꿀팁은 체크아웃전 전화로 0번 눌러서 차번호 알려주시면 미리 뺴주십니다 일층내려와서 차뺴달라고하면 1520분 걸려요 2 신라호텔 바로 주변 택시타고 기본요금 차로도 주차가능한 맛집 중 맛집 신라호텔이 비싸서 가성비 혹은 멋진 공간들을 찾으신다면 을지로에 위치한 행2PM8PM 추천드립니다 매일저녁 인디가수들의 라이브공연도 매일하고 와인이나 맥주 술도 저렴 라자냐파스타와 몽둥이고기가 유명한곳이라 저녁에 코스로 들르기 좋은곳이에요,2024년 3월 25일 월요일,1번째 방문
1,illiiilillil,직원분들 너무 친절하시고 음식맛은 대한민국 호텔부페 넘버원인데 말해뭐해 입니다 조금씩 일찍 입장 시켜주시는 융통성도 좋아요 쬐끔 아쉬운건 의외로 과일류 구색이 약하다는 거,2024년 5월 19일 일요일,1번째 방문
2,shooooooo,종류도 알차게 많고 다 맛있어요,2024년 6월 7일 금요일,1번째 방문
3,Choigo다,신라호텔 파크뷰 조식 이용했습니다11층이라 뷰도 훌륭하고 객실 컨디션이나 청결 서비스상태 좋고 직원분들이 매우 친절하시고 어디에나 어느곳이든 다 상주해계셔서 호텔 서비스 이용하는데 매우 편했습니다 물론 5성급 호텔이라서 숙박비나 발렛파킹비용이 비싼편이지만 돈쓰러오는곳인만큼 가치있어요,2024년 3월 3일 일요일,1번째 방문
4,shekyh,창가자리는 보기만 하고 부스좌석 안내받음 안락하고 좋았어요 대게는 차갑고 짜고 짜장면 도삭면은 불어있고 문어숙회는 너무 안익은 느낌 양갈비 맛있었어요 딸기 달달 한라봉 새콤달콤약 15분 정도 일찍 입장해서 좋았지만 모든 음식코너에 긴줄디저트부터 시작했네요직원분들 서비스가 넘 좋아서 모든게 커버되는거 같아요,2024년 2월 3일 토요일,1번째 방문
5,이진욱쨩,항상 친절하시고 음식도맛있네요,2024년 4월 21일 일요일,2번째 방문
6,KSL1,분위기도 너무 좋고 음식 하나하나 다 만족해 하며 맛있게 먹고 왔습니다 샐러드 킹크랩 스시 모든 재료가 싱싱하고 맛있습니다 고기디저트러버 분들 여기 무조건 추천드립니다 만족한 저녁식사였습니다,2023년 12월 13일 수요일,1번째 방문
7,juehhhhh,부모님 효도여행으로 방문 신라호텔 호캉스도 시켜드리고 뷔페도 먹었는데 만족해하시더라구요다른 뷔페들보다 더 맛있다고 하셔서 뿌듯했습니다,2024년 2월 25일 일요일,1번째 방문
8,인생대박33,방문날 5성급 호텔 뷔페 먹는다고 좋아라하고 갔습니다 신라호텔 입구에서 셔틀타고 올라오면 편하고 좋더라구요그런데 원래이런것인지 도때기시장같은 느낌은 뭘까요 우아하게 먹는게 아니라 한접시 떠와서 먹고 나면 또 가서 줄을 5분이상 서야 했던 듯 합니다 연말기분 내기에는 좋았고 로제스파클링 와인은 무한으로 따라 주더라구요 음식은 신선해서 다른 뷔페보다는 먹을만 했어요직원분들은 엄청 차절해요 역쉬 호텔리어 서비스마인드 굿 그러나 다음에는 누가 초대하면 모를까 내돈내산은 안가고 싶은 곳이였습니다,2023년 12월 16일 토요일,1번째 방문
9,Reinyourheart,신라호텔이 호텔 뷔페 중 1등이라고 생각하는데이번에도 그 생각이 공고해졌습니다음식 퀄리티가 최상입니다 가짓수도 많구요 디저트의 퀄리티도 남다릅니다,2024년 1월 9일 화요일,1번째 방문
10,블리랩,평일 저녁식사하러 방문하였습니다 서울에 있는 거의 모든호텔뷔페는 다 가봤지만 파크뷰만한곳이 없는거같기도해요 덕분에 기분좋은 저녁식사와 함께 즐거운 시간 보내고왔습니다 메뉴 구성도 알차고 바로바로 내어주시는 음식덕분에 역시 더 파크뷰네요 하고 말할수잇네요,2023년 11월 14일 화요일,1번째 방문
11,미국주식왕,네번째 방문만에 창가자리에서 먹게 되어서 기쁨그리고 카페라떼 맛집,2024년 3월 10일 일요일,1번째 방문
12,민정남이,처음 가 본 신라호텔 더 파크뷰 맛있었어요디저트쪽 메뉴들특히 요거트아이스크림과 퐁당쇼콜라 최고 좋아하는 게 많았어서 특히 기억에 남고 쌀국수 도삭면으로 만든 짜장면도 별미였어요 꽃게탕면보다 저 두개를 더 추천하고 싶어요 샐러드랑 회 코너는 재료가 다양하고 신선해서 여러번 먹었어요 개인적으로 북경오리 LA갈비는 좀 별로였고 스테이크 아주 부드러웠어요 양갈비도 맛있다고 하네요 여유만 된다면 당연 재방문 하고 싶은 곳,2023년 10월 19일 목요일,1번째 방문
13,이린스타일,연말에 평일 디너를 어떻게든 다녀왔었습니다 사람이 많았지만 즐거웠고 구성이 알차서 좋았어요,2023년 12월 14일 목요일,1번째 방문
14,헝겉,주차 타워에 대고 셔틀 혹은 걸어서 이동합니다비용이 조금 세긴 하지만 디너 부페로 오시는거 추천하고각자 소중한 사람들과 특별한 시간 보내기 좋습니다,2023년 12월 2일 토요일,1번째 방문
15,A8뜨뚜,신라호텔 더 파크뷰 뷔페인당 가격대가 잇지만 대게나 음식 퀄리티가 좋아요간도 딱좋고 전체적으로 종류의 발란스가 좋앗습니다직원분들 친절하시구 주차도 편해요가족단위 손님들이 많으시더라구요 특별한 날 가족들과 오기에 좋은거같아요,2023년 10월 1일 일요일,1번째 방문
16,Jessica Park,몇번 갈때 마다 늘 테이블이 협소한게 가장 아쉽지만22일 생일이라 디너로 갔는데 서비스도 메뉴도대만족 입니다,2023년 12월 22일 금요일,1번째 방문
17,민트쵸코75,디저트류가 좋았어요,2024년 4월 10일 수요일,1번째 방문
18,DEAN KIL,비싸지만 좋은곳,2024년 5월 4일 토요일,1번째 방문
19,CTStory,240218토너무 비쌈애슐리 퀸즈가 짱인듯 ,2024년 2월 17일 토요일,1번째 방문
20,yr0****,와이프 생일에 처음 가본 호텔 뷔페최고였어요 아이를 위한 도화지와 색연필까지 감동이네요 재방문 의사 100입니다대게랑 양갈비 안심스테이크는 사랑입니다디저트 및 과일 모두 최고였어요,2023년 11월 4일 토요일,1번째 방문
21,예예예예예84,비싼만큼 서비스와 맛이 있어요특별한날 부모님과 함께 오기 좋아요,2024년 2월 3일 토요일,1번째 방문
22,ERANGMAM,애기가 스테이크 너무 잘먹었어요언제나 더파크뷰는 흠이없어요 친절함과 식사의 품질은 어느곳과 비교가되질않아요,2024년 1월 3일 수요일,2번째 방문
23,AtoZer,신라호텔 더파크뷰호텔 뷔페 중에서도 음식의 퀄리티와 맛이 단연 으뜸이라 할 수 있죠가격은 좀 있는 편이지만 기념일에 갔다오기에 손색이없는 구성과 친절한 서비스이 감탄했고음식 가짓수만 많은게 아니라 한 메뉴 한 메뉴가 높은 품질의 식재료로 만들어졌다는게 느껴졌어요뷔페라고 모든게 셀프가 아니라충분한 스텝인력이 배치되어 있어서편하게 잘 이용했습니다더파크뷰는 앞으로도 계속 방문할 예정이에요한가지 아쉬운 점은좌석이 너무 붙어있어서옆테이블 대화가 모두 들리고 privacy가 없다는점이 조금 아쉽습니다이 부분은 분명히 개선될 수 있는 점 같아요,2023년 11월 10일 금요일,2번째 방문
24,까꿍쓰마미,가격대비 면 그냥 그랬음 대게로 뽕뽑으라는데 막상 넘 차가워서 쉽게 물림다른것들도 하나씩 먹었는데 맛있다 정도디카페인바닐라라떼 맛났음아스크림 필수,2024년 1월 15일 월요일,1번째 방문
25,아침햇살미소,연말모임하기 좋아요 회랑 대게 디저트까지 푸짐해요,2023년 12월 7일 목요일,1번째 방문
26,이진욱쨩,너무친절 음식도 너무맛있어욤 역시 신라호텔 체고,2023년 11월 19일 일요일,1번째 방문
27,tlsdmswl0725,가족들이랑 저녁먹으러 갔다왔어요음식들이 다 맛있고 매장도 깨끗했어요,2024년 1월 28일 일요일,1번째 방문
28,골드곰돌이,사람이 많아서 복잡하긴 하지만 맛있게 잘 먹었습니다,2024년 2월 10일 토요일,1번째 방문
29,ㅎ나ㅎ,평일 브런치 다녀왔는데 금요일이라 그런지 사람 엄청 많네요 대게 쯔란양념등갈비 피칸파이 딸기 특히 맛있던 것 같습니다 좌석 간격이 좀 좁고 옆 좌석 이야기가 너무 잘 들리는 것은 좀 아쉬웠어요 ,2024년 1월 19일 금요일,1번째 방문
30,빙그레9489,특별한 날 가기 좋아요,2024년 1월 7일 일요일,1번째 방문
31,펭님ㅇ,여기 포함 호텔뷔페 3곳 가봄여기가 직원분들이 제일 친절하심그런데 음식은 맛없는건 없었지만 특별히 엄청 맛있다고 느낀게 없어서 아쉬웠음그리고 좌석 배정도 랜덤이어서 나 아니어도 내가 앉은 자리를 누군가가 앉았겠지만 이 돈 내고 이런 좌석에서 또 다시 불편하게 식사하고 싶진 않음다른 뷔페보다 확실히 좌석이 불편함 편한 좌석도 물론 있었는데 혹시나 불편한 좌석 걸리면 옷 놓기도 애매하고 밥 먹기 좀 힘듦기념 사진도 찍어주셨는데 조명도 별로인데다가 사진도열심히는 찍어주셨는데 귀신처럼 나옴직원분이 이상하게 나와서 한장 더 찍자고 먼저 말씀하실 정도였음 적으면서 다시 생각해보니 확실히 별로였네요,2023년 12월 25일 월요일,1번째 방문
32,히지123,비싼만큼 값어치 하는곳 다 맛있는데 디저트먹을 배는 꼭 남겨두세요,2023년 11월 12일 일요일,1번째 방문
33,vivajin,좋아요,2024년 5월 25일 토요일,1번째 방문
34,this7686,진짜 진짜 맛나게 먹고 왓습니다 또 가고 싶네요진짜 너무 좋앗습니다친절함도 최고 엿음요,2023년 12월 3일 일요일,1번째 방문
35,YHJ61,굿,2024년 3월 29일 금요일,1번째 방문
36,zzombie87,신라호텔 파크뷰 부페 맛남캅비싸긴 하지만 맛있게 잘 먹고 갑니다음식이 너무 맛있어서 사진을 못 찍음 집에 가는 길에 로비 장식만 찍읍니다,2023년 12월 17일 일요일,1번째 방문
37,딩두딩듀,서비스카도 있고 주차장도 넓고 자리도 지정해줘서 좋음 계절음식으로 깔끔하게 되어있고 근사한 뷰 먹으면서 저녁먹기에 추천할곳 저녁에 가서 야경먹으면서 음식보자 서울의 중심지 신라호텔 재방문의사 너무있음,2023년 10월 19일 목요일,1번째 방문
38,냐냥865,메뉴 구성이 알차고 맛있어요 또가고 싶다,2023년 10월 22일 일요일,1번째 방문
39,근현이,생각보다 음식이 종류가 적어서 속상해요,2024년 1월 18일 목요일,1번째 방문
40,와구아궁,베스트 메뉴는 양갈비였습니당 안심스테이크 회 대게도 진짜 배터지게 먹었네요 그리고 딤섬류도 은근 별미에요 막판에 배불러서 디저트 많이 못먹은게 아쉽네요  신라 더파크뷰 최고,2023년 10월 26일 목요일,1번째 방문
41,asd123364,생일날 3대 호텔 신라호텔로 예약했습니다 재료는 다 신선한 편이였고 음식종류가 많은건 아니였어요 다만 있는 음식들이 다 맛있어요 배불러서 많이 못먹은게 후회되네요 디저트 케익은 정말 끝내주네요,2023년 9월 6일 수요일,1번째 방문
42,낭이맘62,역시 신라 더 파크뷰입니다특별한 메뉴도 메뉴지만흔한 메뉴들도 참 정갈하고 맛있어요특별한 날 맘 먹고 가서 맛있는 밥 먹고 왔어요자주 가기에는 부담이지만 한번 다녀오고 나면 아주 행복합니다,2023년 10월 21일 토요일,2번째 방문
43,나라나57,너무 맛있고 분위기 좋습니다,2024년 1월 5일 금요일,2번째 방문
44,뚠키부인,전통의 신라 메뉴 하나하나 다 훌륭양갈비와 안심 너무 연하고 테이블마다 나오는 스프도 맛있어요 베이커리류는 전반적으로 좀 단맛이 강함12월부터 가격 인상해서 슬픔,2023년 11월 5일 일요일,1번째 방문
45,엔유라,역시 신라호텔분위기 좋은곳에서 맛있는 음식 잘 먹고 왔습니다 멀리 보이는 남산타워와 함께 너무 좋은 분위기였어요,2023년 9월 14일 목요일,1번째 방문
46,lsh****,신선하고 질이 좋습니다 ,2023년 10월 9일 월요일,1번째 방문
47,또이또이이,오랫만에 디너왓어요 스파클링워터 무제한이였구용 전엔 안그랫던거같은데 북경오리가 참 맛잇엇어요,2023년 9월 21일 목요일,1번째 방문
48,hay****,대게와 양갈비를 먹어야 한다고 하더라구요 전체적으로 맛있습니다 하지만 배가 불러 힘들어요,2023년 11월 12일 일요일,1번째 방문
49,하쿠나마타타8510,친구들 모임으로 가서 맛있게 먹고 대접받고 왔네요 양갈비 맛있다고 하는데 전 양갈비도 좋았지만 스테이크 정말 맛있었습니다,2023년 11월 18일 토요일,1번째 방문
50,shf****,말해뭐하나요 맛있는게 너무 많아서 배가 부른 내가 싫을 정도예요,2023년 11월 5일 일요일,1번째 방문
51,듀듀렁,굿,2024년 3월 5일 화요일,1번째 방문
52,악마의 유혹,서비스 굿,2024년 1월 13일 토요일,1번째 방문
53,carpe diem1004,,2024년 3월 10일 일요일,2번째 방문
54,Dream1053,대한민국 최고 5성급호텔에 걸맞는 멋진인테리어와 고급스러운 분위기 육류해산물중식일식디저트까지 풍부하고 맛있는음식 23층에 있는 미쉐린 2스타에 빛나는 라연에도 뒤지지않는 남자직원분들의 수준높은 친절한 서비스에 너무나 기분좋게 감동했지만 개념없는 웨이트리스 때문에 어이가 없었던곳 명품매장에서 일한다고 본인이 명품이라고 착각하고 편한옷차림의 고객분들 함부로 평가하고 깔보고 무시하는 한심한 직원처럼 5성급 호텔에서 일한다고 본인이 5성급이라 착각하고 뭐좀 요구하면 짜증내는표정 고객을 꾸중하는듯한 말투와 형편없는 서비스 한두번참다가 정색하고 성함 좀 말씀해주시라고 너무 불친절해서 관리자님에게 말씀드리겠다고하니 그때부턴 갑자기 환한미소와 함께 급친절 하진짜하지만 웨이트리스 빼곤 모든게 너무나 좋았던곳,2023년 9월 4일 월요일,1번째 방문
55,SINCE2006,신라신라했어요,2023년 10월 22일 일요일,1번째 방문
56,gudrmfl2,맛나요,2024년 6월 7일 금요일,1번째 방문
57,소나기5954,음식이 맛있어요,2023년 11월 19일 일요일,1번째 방문
58,고려갸2,맛있어오,2024년 1월 21일 일요일,1번째 방문
59,Happy 깡총깡총,다양한 음식이 많았어요 맛있게 잘 먹었어요 휴일이라 사람이많았어요,2023년 10월 7일 토요일,1번째 방문
60,이희로,부진 언니 잘 먹고 갑니다,2023년 11월 6일 월요일,1번째 방문
61,moolcho,제일 좋아하는 뷔폐에요 가격이 오르고 더 만족도가 올라가네요 물론 가격이 비싸서 자주는 못가고 특별한날에만 갈수 있지만 맛 구성 시설 직원분들 친절 너무너무 만족하고 갑니다 한번 꼭 가보세요,2023년 6월 20일 화요일,1번째 방문
62,s1018j,굿,2024년 2월 25일 일요일,1번째 방문
63,푸른소금8324,초밥이입에서녹아요,2023년 12월 17일 일요일,2번째 방문
64,나라나57,다음에 또갈거에요,2023년 10월 28일 토요일,1번째 방문
65,정구연63,서울3대뷔페어서 점심 먹었는데 너무 맛있어요 중식 베이징덕 크림새우 등 최고,2023년 11월 4일 토요일,1번째 방문
66,Sky KQ,너무맛있어요,2023년 12월 16일 토요일,1번째 방문
67,zi****,가격은비싸지만 비싼값어치를하는곳친절한응대와 서비스도 넘 만족,2023년 10월 15일 일요일,1번째 방문
68,또요미밍,진짜 파크뷰 최고와 또가고싶다돈벌어야하는 이유를 찾음,2023년 7월 31일 월요일,1번째 방문
69,가영573,말해뭐해행복하게 먹고 왔다,2023년 7월 18일 화요일,1번째 방문
70,오닝13,굿,2023년 12월 17일 일요일,1번째 방문
71,슈가가,,2023년 10월 17일 화요일,1번째 방문
72,아라동 외로운주먹,굿,2023년 12월 2일 토요일,1번째 방문
73,whi****,종류가 다양해요 스시맛있었고 고기류는 solo디저트도 생각보다는 별루였어요,2023년 8월 30일 수요일,1번째 방문
74,duf****,기념일에 가기 좋고 저는 개인적으로 스테이크굽기가 딱 제가 좋아하는굽기라서 제일 맛있게먹었네요 창가앉으려면 미리 예약하는게 좋고 밤에는 잘 안보여서 창가는 낮에 추천합니다,2023년 5월 1일 월요일,1번째 방문
75,기대서,좋아요,2023년 12월 27일 수요일,1번째 방문
76,방귤이,비싸지만 돈이 아깝지 않았던오마카세먹는 것보다 훨씬 나은 호텔뷔페찬양,2023년 6월 11일 일요일,1번째 방문
77,코코리383,맛있어요,2024년 5월 28일 화요일,1번째 방문
78,gpwlsdl486,음식이 전체적으로 신선하고 너무너무 맛이좋았습니다 근데 디저트코너에 있는 오이라임주스는 맛이없어요  쿨라임모히토처럼 음식의 느끼함을 없애주는 음료라던지 소화에 도움될만한 매실 음료가 좋을듯해요,2023년 8월 6일 일요일,1번째 방문
79,쭈콩햇,마카롱 너무 맛나고 양고기 냄새 안나서 좋았어용,2023년 10월 19일 목요일,1번째 방문
80,AtoZer,고급진 셀렉션도 많고 뷔페로써 부족함 없는 구성 입니다분위기나 서비스도 맘에 들었고요음식맛이나 서빙도 친절했어요 사람이 많은건 뷔페라 어쩔 수 없긴 한데 프라이버시가 아예 없다는 느낌 대화에 방해가 되는 정도는 전혀 아니었어요,2023년 3월 5일 일요일,1번째 방문
81,땡큐맘7,뷰도 멋지고 메뉴들도 하나하나 정성이 가득 담겨 있는 듯 담백하고 맛있었어요,2023년 5월 29일 월요일,1번째 방문
82,사악토리,1주년으로 다녀왔는데 완전 만족,2023년 5월 25일 목요일,1번째 방문
83,qjfvh1291,모임으로 갔는데 너무 재미있고 맛있었어요,2023년 9월 1일 금요일,1번째 방문
84,후기요정짠,언제가도 좋은 파크뷰,2023년 7월 9일 일요일,1번째 방문
85,00112233445566,,2023년 11월 9일 목요일,1번째 방문
86,해바라기4025,,2024년 2월 23일 금요일,5번째 방문
87,희야7168,,2023년 8월 24일 목요일,2번째 방문
88,Nayanzz,굿,2023년 10월 21일 토요일,1번째 방문
89,안테나8930,,2024년 2월 18일 일요일,1번째 방문
90,yo****,생일전야 저녁에 방문했는데 분위기도 정말 고급지고음식도 모두 훌륭하고 간만에 자연스레 과식했네요 가격이 있는 만큼 특별한 날 가기에 딱인거 같아요,2023년 3월 2일 목요일,1번째 방문
91,re2na,친절하고 맛있어요,2023년 7월 15일 토요일,1번째 방문
92,kyu****,좋아요,2023년 11월 6일 월요일,1번째 방문
93,ciao4,중식 메뉴 일식 메뉴 순으로 좋았어요 안쪽 2인석이었는데 조금 더 밝았으면 싶어요 커피가 맛있었습니다,2023년 7월 25일 화요일,1번째 방문
94,예롱쓰,처음 방문해보는 더파크뷰랜덤이라 하셨는데 창문자리로 안내 해주셨어요금요일 저녁이었는데도 설날 전이긴 했지만 사람 많았어요확실히 육류보단 해산물이 더 맛있었어요대게 수율도 좋았습니당그리고 정말 배부른 와중에도 너무 맛있게 느낀 마카롱들 디저트 넘넘 맛있더라구요 친절함은 말해모해 너무 좋았습니당,2023년 1월 20일 금요일,1번째 방문
95,twinmommy,안심 LA갈비 양갈비 부드럽고 맛있었어요,2023년 5월 27일 토요일,1번째 방문
96,fre****,메뉴 알차요디저트도 맛있는데배가 너무 불러서  대신 탄산음료는 따로 계산하셔야해요 주차는 아래에 하고 셔틀버스로 올라와서불편한건 없었네요특별한날 오기 좋겠어요,2023년 4월 12일 수요일,1번째 방문
97,qkd****,가족들이랑 너무 좋은시간이였고음식이 입맛에 딱이며 너무 맛있어요,2023년 7월 15일 토요일,1번째 방문
98,토토어뭉,생일기념으로 왔어요기념일때 올만해요,2023년 5월 14일 일요일,1번째 방문
99,소금주에잉,서울3대뷔페라 하는 이유를 알겠음 친절하고 동선이 편하고 대접받는 느낌이 강하게 들었음 앞으로도 중요한 행사가 있다면 신라호텔 더파크뷰에서 하고싶을 정도임,2023년 2월 10일 금요일,1번째 방문
100,rkg****,운좋게 뷰좋은 창가쪽에서 저녁식사했어요음식이 하나같이 다 맛있어서 배불러오는게 너무 아까웠어요 특히 대게는 너무 맛있어서 몇 번을 먹었는지 모르겠네요왜 인기가 많은지 알겠어요,2023년 3월 4일 토요일,1번째 방문
101,설 화,굿 테이스팅,2023년 8월 6일 일요일,1번째 방문
102,솔몬이닉넴,좋아요,2023년 8월 28일 월요일,1번째 방문
103,asu****,음식이 정말 맛있어요,2023년 7월 27일 목요일,1번째 방문
104,뱁95,명절 가족식사 했는데 직원분들 다 친절하고 음식 다 맛있었어요 다른호텔도 다녀봤는데 사전에 알러지 물어보시고 체크해주시는 센스 없었는데 신라는 신라인가봐요앉을 때 물어봐주시고 담을때 물어보면 설명도 잘해주시고 감동 그 자체 중식도 맛있고 스시도 괜찮았어요 룸도 따로 있어서 가족모임 예약시 참고하셔도 좋을 것 같아요 특히 커피 드실때 YMYoon 이라는 분이 내리는 라떼 드세요 진짜 호텔 식사가서 먹는 커피 기대 잘안하는데 신라는 뭔가 다르다는 걸 느꼈어요 다음에 가족식사가 있으면 또 신라로 올것 같아요 가격 거의 비슷비슷한데 신라가 더 좋아요,2023년 1월 22일 일요일,1번째 방문
105,청룡동잇프피,,2023년 6월 30일 금요일,1번째 방문
106,khk1,,2023년 9월 26일 화요일,1번째 방문
107,맛짱루피,분위기 좋아요,2024년 2월 25일 일요일,1번째 방문
108,개복치박프로,팔선 너무 맛있습니다,2023년 7월 6일 목요일,1번째 방문
109,cok****,웰컴와인에 즐거운 저녁시간 보냈어요,2023년 4월 23일 일요일,1번째 방문
110,까꿍,굿,2023년 9월 15일 금요일,1번째 방문
111,wnd****,일단 사람이 너무 많아서 깜짝 놀랐는데 그래도 수월하게 입장이 진행되었어요 조개샐러드 진짜진짜 맛있어서 두 번먹었어요꼭 드셔보세요 회는 그냥 좋은 회다 요 정도였는데 초밥이 진짜 미쳤어요 너무 맛있음 딱새우회도 맛있긴 함 그리구 딸기가 진짜 말도 못하게 맛있어서원래 과일 안 좋아함 거의 한접시 와구와구 먹었어요 막판에 먹방 찍은 듯해요  같이 간 일행이 저 먹는 거 보더니 딸기를 또 한 접시 퍼왔어요 다른 분들은 크랩 갈비 양갈비 많이들 가져다 드시더라고요  초반에는 초밥 회에 줄이 길고 중반에는 고기 줄이 기니까 기다리기 싫은 분들은 참고해서 청개구리처럼 거꾸로 드세요,2022년 12월 20일 화요일,1번째 방문
112,코코바닝,좋은곳에서 좋은 서비스 받고 맛있게 먹고 갑니다역시 서울 3대뷔페,2023년 2월 10일 금요일,1번째 방문
113,celi,직원분들 친절하고 음식들 다 맛있어요특히 샐러드 파트에서는 피조개 된장무침 샐러드 엄청 맛있었네요디저트도 두말할거 없이 훌륭최근 가격 인상되서 아쉽지만 워낙 물가가 요동치니 어쩔수 없죠,2023년 3월 24일 금요일,1번째 방문
114,whateveriwant,메뉴도 다양하고 조금씩 변화되는게 좋아요변함없는 맛과 친절한 서비스국내호텔뷔페 원탑계임좋은날에 가기 쵝오 단 예약이 너무빡심,2023년 1월 1일 일요일,2번째 방문
115,신양갱2,,2023년 12월 13일 수요일,1번째 방문
116,플레이스MY,뭐라 할 말이 없음 다 맛있어요 평일 런치로 가면 줄도 안서고 바로 들어가서 좋네요 그리고 계산할때 와인 1병도 선물로 줬어요,2023년 1월 27일 금요일,1번째 방문
117,냠냠이v,비싸지만 한번은 가볼만 해요 역시 대한민국 1등 호텔,2023년 5월 12일 금요일,1번째 방문
118,나는다슬기50,창가자리에 앉아서 뷰가 넘 좋고음식들이 다 맛있어서 넘 좋은 시간 보냈어요,2023년 2월 1일 수요일,1번째 방문
119,Ruru43,디저트와 양갈비 맛집입니다 또갈게요,2023년 2월 11일 토요일,1번째 방문
120,쫑이2472,아기 생일이라 가족들 룸예약해서 다녀왔는데 온라인 예약으로 성공했어요 음식도 맛있었고 서비스도 좋아 만족합니다,2023년 4월 7일 금요일,2번째 방문
